complaint_id,date_raised,city,ward,location,description,reported_by,days_open,category,priority,reason,flag
PM-202401,2024-06-21,Pune,Ward 4 – Warje,Karve Road near Deccan Gymkhana,Large pothole 60cm wide causing tyre damage. Three vehicles affected this week.,Citizen Portal,4,Pothole,Standard,Classified as Pothole because the description includes the word 'pothole'.,
PM-202402,2024-06-04,Pune,Ward 3 – Kothrud,FC Road near MIT College junction,Deep pothole near bus stop. School children at risk during morning hours.,Councillor Referral,12,Pothole,Urgent,"Classified as Pothole because it mentions 'pothole', and marked Urgent due to the severity keyword 'school'.",
PM-202406,2024-06-08,Pune,Ward 1 – Kasba,Ambedkar Road underpass,Underpass flooded knee-deep after 2hrs rain. Commuters stranded.,Councillor Referral,8,Flooding,Standard,Classified as Flooding because the description includes the word 'flooded'.,
PM-202408,2024-06-05,Pune,Ward 3 – Kothrud,Kothrud Depot bus stand,Bus stand flooded. Passengers standing in water. Drain blocked.,Ward Office Walk-in,12,Flooding,Standard,Classified as Flooding because the description includes the word 'flooded'.,NEEDS_REVIEW
PM-202410,2024-06-04,Pune,Ward 2 – Shivajinagar,JM Road near Goodluck Chowk,Three consecutive streetlights out for 10 days. Area very dark at night.,Email,18,Streetlight,Standard,Classified as Streetlight because the description includes the word 'dark'.,
PM-202411,2024-06-22,Pune,Ward 2 – Shivajinagar,"Viman Nagar, Vadgaon Sheri Road",Streetlight flickering and sparking. Electrical hazard reported.,Social Media,9,Streetlight,Urgent,"Classified as Streetlight because it mentions 'sparking', and marked Urgent due to the severity keyword 'hazard'.",
PM-202413,2024-06-29,Pune,Ward 1 – Kasba,Shivajinagar market area,Overflowing garbage bins near vegetable market. Smell affecting shoppers.,WhatsApp Helpline,13,Waste,Standard,Classified as Waste because the description includes the word 'garbage'.,
PM-202418,2024-06-02,Pune,Ward 4 – Warje,Kalyani Nagar residential zone,Wedding venue playing music past midnight on weeknights.,Citizen Portal,5,Noise,Standard,Classified as Noise because the description includes the word 'music'.,
PM-202419,2024-06-01,Pune,Ward 2 – Shivajinagar,Senapati Bapat Road,Road surface cracked and sinking near utility work done 1 month ago.,Social Media,2,Road Damage,Standard,Classified as Road Damage because the description includes the word 'cracked'.,
PM-202420,2024-06-03,Pune,Ward 1 – Kasba,Paud Road near Kothrud,Manhole cover missing. Risk of serious injury to cyclists.,Email,14,Drain Blockage,Urgent,"Classified as Drain Blockage because it mentions 'manhole', and marked Urgent due to the severity keyword 'injury'.",
PM-202427,2024-06-07,Pune,Ward 5 – Hadapsar,Erandwane depression near bridge,Bridge approach floods in 30mins of rain. Bridge becomes inaccessible.,Councillor Referral,12,Flooding,Standard,Classified as Flooding because the description includes the word 'floods'.,
PM-202428,2024-06-23,Pune,Ward 3 – Kothrud,Pune University Road,Dead animal not removed for 36 hours. Health concern.,Email,1,Waste,Standard,Classified as Waste because the description includes the word 'animal'.,
PM-202430,2024-06-23,Pune,Ward 1 – Kasba,"Rasta Peth, old city area","Heritage street, lights out. Safety concern for pedestrians after dark.",Social Media,19,Streetlight,Standard,Classified as Streetlight because the description includes the word 'lights'.,NEEDS_REVIEW
PM-202433,2024-06-08,Pune,Ward 2 – Shivajinagar,Dhole Patil Road,Bulk waste from apartment renovation dumped on public road.,Phone Helpline,20,Waste,Standard,Classified as Waste because the description includes the word 'waste'.,
PM-202446,2024-06-09,Pune,Ward 2 – Shivajinagar,"Swargate, Tilak Road",Footpath tiles broken and upturned. Elderly resident fell last week.,Email,18,Road Damage,Urgent,"Classified as Road Damage because it mentions 'broken', and marked Urgent due to the severity keyword 'fell'.",
